{"status":"OK","code":200,"locale":"en_US","seed":"42","total":2,"data":[{"id":1,"name":"Brekke-Bartoletti","email":"xboehm@gmail.com","vat":"09853775915","phone":"+15743577321","country":"Somalia","addresses":[{"id":1,"street":"3026 Dorcas Drive","streetName":"Colt Forest","buildingNumber":"37572","city":"Marquardtside","zipcode":"24228-5876","country":"Somalia","country_code":"SO","latitude":84.583773,"longitude":79.919558},{"id":1,"street":"269 Hackett Crest Suite 329","streetName":"Wyman Row","buildingNumber":"432","city":"Rickyfort","zipcode":"57351-2143","country":"\u00c5land Islands","country_code":"AX","latitude":-48.101159,"longitude":-15.814804},{"id":1,"street":"12370 Carolyne Fort","streetName":"Brody Crest","buildingNumber":"160","city":"New Omari","zipcode":"47204-0177","country":"French Southern Territories","country_code":"TF","latitude":-20.625029,"longitude":-70.339042}],"website":"http:\/\/steuber.com","image":"http:\/\/placeimg.com\/640\/480\/people","contact":{"id":1,"firstname":"Ashton","lastname":"Bogan","email":"kendall.weissnat@yahoo.com","phone":"+16186959992","birthday":"1974-08-25","gender":"male","address":{"id":1,"street":"536 Desmond Heights Apt. 496","streetName":"Kihn Rest","buildingNumber":"635","city":"Bernieland","zipcode":"78082","country":"Cyprus","country_code":"CY","latitude":48.828662,"longitude":38.145593},"website":"http:\/\/hagenes.info","image":"http:\/\/placeimg.com\/640\/480\/people"}},{"id":2,"name":"Veum, Schroeder and Runolfsdottir","email":"nathaniel.klein@gmail.com","vat":"0708891314","phone":"+12485951709","country":"Croatia","addresses":[{"id":1,"street":"9966 Bode Mountain","streetName":"Autumn Square","buildingNumber":"935","city":"Marlenetown","zipcode":"22146","country":"Kazakhstan","country_code":"KZ","latitude":-5.001314,"longitude":-42.146325},{"id":1,"street":"57090 Laisha Trafficway","streetName":"VonRueden Lodge","buildingNumber":"53870","city":"South Ethyl","zipcode":"87326","country":"Christmas Island","country_code":"CX","latitude":71.237448,"longitude":49.107747}],"website":"http:\/\/quigley.com","image":"http:\/\/placeimg.com\/640\/480\/people","contact":{"id":1,"firstname":"Kristy","lastname":"Donnelly","email":"myrtle04@murazik.net","phone":"+12768316602","birthday":"1993-03-22","gender":"female","address":{"id":1,"street":"5842 Kautzer Overpass","streetName":"Beulah Expressway","buildingNumber":"43432","city":"West Howellmouth","zipcode":"08139-6733","country":"Equatorial Guinea","country_code":"GQ","latitude":35.334769,"longitude":-0.99054},"website":"http:\/\/murray.com","image":"http:\/\/placeimg.com\/640\/480\/people"}}]}