{"status":"OK","code":200,"locale":"en_US","seed":"42","total":2,"data":[{"title":"Nisi veritatis quia ut est.","description":"Ut est maxime et. Impedit sit aut illum. Facere quibusdam atque sed debitis nisi.","url":"https:\/\/picsum.photos\/640\/480"},{"title":"Et mollitia eos optio aut.","description":"Explicabo doloremque vero nulla veniam voluptas eius sint. Ratione non necessitatibus possimus ea modi omnis architecto.","url":"https:\/\/picsum.photos\/640\/480"}]}