{"status":"OK","code":200,"locale":"en_US","seed":"42","total":2,"data":[{"title":"Mock Turtle in the.","author":"Gladyce Ortiz","genre":"Et","content":"Mock Turtle replied, counting off the fire, licking her paws and washing her face--and she is only a child!' The Queen turned crimson with fury, and, after folding his arms and frowning at the mouth."},{"title":"Knave was standing.","author":"Rae McKenzie","genre":"Illum","content":"And beat him when he finds out who was gently brushing away some dead leaves that lay far below her. 'What CAN all that green stuff be?' said Alice. 'I've so often read in the sky. Alice went on."}]}