{"status":"OK","code":200,"locale":"en_US","seed":"42","total":2,"data":[{"id":1,"firstname":"Brown","lastname":"Schroeder","email":"emilie24@fahey.com","phone":"+18725574706","birthday":"1939-03-20","gender":"male","address":{"id":1,"street":"599 Huel Drive Suite 372","streetName":"Gladyce Bypass","buildingNumber":"6739","city":"East Trevorstad","zipcode":"25475-1707","country":"North Korea","country_code":"KP","latitude":85.275994,"longitude":-48.109736},"website":"http:\/\/jerde.com","image":"http:\/\/placeimg.com\/640\/480\/people"},{"id":2,"firstname":"Verlie","lastname":"Kerluke","email":"hblanda@romaguera.com","phone":"+16518175720","birthday":"2013-01-27","gender":"female","address":{"id":1,"street":"8553 Beatty Islands Apt. 491","streetName":"Aglae Bridge","buildingNumber":"8490","city":"New Shanieton","zipcode":"82603-0589","country":"Somalia","country_code":"SO","latitude":3.612244,"longitude":-105.141001},"website":"http:\/\/kirlin.org","image":"http:\/\/placeimg.com\/640\/480\/people"}]}