{"status":"OK","code":200,"locale":"en_US","seed":"42","total":2,"data":[{"id":1,"uuid":"23dfa992-ff16-30e9-80f4-75a1814d0efa","firstname":"Oscar","lastname":"Williamson","username":"udach","password":"Xq7OuxC\"n@=8?\"~8","email":"vernice.bartoletti@gmail.com","ip":"78.226.209.203","macAddress":"39:15:FC:EB:58:30","website":"http:\/\/cronin.biz","image":"http:\/\/placeimg.com\/640\/480\/people"},{"id":2,"uuid":"f92c5482-6f45-382c-8f52-5e9d066488db","firstname":"Eloy","lastname":"DuBuque","username":"njerde","password":"qr)tCN$[","email":"romaguera.johathan@koelpin.com","ip":"116.234.41.131","macAddress":"58:3B:0D:F1:F9:08","website":"http:\/\/volkman.net","image":"http:\/\/placeimg.com\/640\/480\/people"}]}