{"status":"OK","code":200,"locale":"en_US","seed":"42","total":2,"data":[{"id":1,"street":"1414 Dach Prairie Apt. 113","streetName":"Colt Forest","buildingNumber":"37572","city":"Marquardtside","zipcode":"24228-5876","country":"Mauritania","country_code":"MR","latitude":84.583773,"longitude":79.919558},{"id":2,"street":"269 Hackett Crest Suite 329","streetName":"Wyman Row","buildingNumber":"432","city":"Rickyfort","zipcode":"57351-2143","country":"\u00c5land Islands","country_code":"AX","latitude":-48.101159,"longitude":-15.814804}]}