{"status":"OK","code":200,"locale":"en_US","seed":"42","total":2,"data":[{"id":1,"name":"Et sed impedit sit aut.","description":"Nisi provident qui vero nam et aspernatur amet. Omnis inventore dolor et ut. Omnis facilis ratione totam dicta cupiditate enim. Blanditiis ratione nihil vel consequuntur voluptatem.","ean":"2369661397200","upc":"967609529178","image":"http:\/\/placeimg.com\/640\/480\/tech","images":[{"title":"Sint ratione totam occaecati.","description":"Natus ut voluptas deleniti non dolorum eum. Omnis omnis asperiores velit vero inventore hic facilis. Omnis inventore consequatur distinctio est. Ab qui commodi eum.","url":"https:\/\/picsum.photos\/640\/480"},{"title":"In ipsum quia quae nam.","description":"Et quidem similique velit voluptas earum voluptatibus voluptatibus. Nam molestias delectus asperiores rem reiciendis. Est et inventore ipsa doloremque velit veritatis facere.","url":"https:\/\/picsum.photos\/640\/480"},{"title":"Iusto vitae ipsam quia.","description":"Ut illo ipsum ut pariatur beatae sed. Sit molestiae a cumque nobis excepturi quia vero. Est deleniti explicabo praesentium id modi.","url":"https:\/\/picsum.photos\/640\/480"}],"net_price":1015069.03,"taxes":22,"price":1238384.22,"categories":[27,28,29,30,31],"tags":["laborum","dolores","laudantium","saepe"]},{"id":2,"name":"Qui officia inventore et.","description":"Ut eveniet a aut dolorem reiciendis. Vitae quibusdam nisi esse voluptas. Minima veniam deserunt beatae voluptatibus eum reprehenderit.","ean":"4656648527667","upc":"382397673789","image":"http:\/\/placeimg.com\/640\/480\/tech","images":[{"title":"Ut quaerat sequi enim est.","description":"Inventore possimus sint ipsum aut. Architecto excepturi quam et qui reiciendis. Fugit nesciunt doloribus rerum ipsa blanditiis pariatur natus.","url":"https:\/\/picsum.photos\/640\/480"},{"title":"Consequatur ab ut qui rerum.","description":"Est quae consequatur dolores expedita. Provident dicta corrupti provident qui et rerum. Voluptatum quasi omnis cupiditate vero mollitia ut dolor. Nulla doloribus veniam asperiores.","url":"https:\/\/picsum.photos\/640\/480"},{"title":"Ut odio dolore sed.","description":"Aspernatur deserunt nobis dolorum et accusantium. Ipsam minus sunt adipisci dolorem incidunt nostrum. Quisquam non deleniti a perferendis ut officia saepe. Consectetur sit ducimus error et illo.","url":"https:\/\/picsum.photos\/640\/480"}],"net_price":7.55,"taxes":22,"price":9.21,"categories":[72,73,74,75],"tags":["voluptatem"]}]}