{"status":"OK","code":200,"locale":"en_US","seed":"42","total":2,"data":[{"id":1,"title":"Mock Turtle in the.","author":"Gladyce Ortiz","genre":"Et","description":"Mock Turtle replied, counting off the fire, licking her paws and washing her face--and she is only a child!' The Queen turned crimson with fury, and, after folding his arms and frowning at the mouth.","isbn":"9797826980333","image":"http:\/\/placeimg.com\/480\/640\/any","published":"2003-10-05","publisher":"Optio Aut"},{"id":2,"title":"For some minutes.","author":"Vince Wintheiser","genre":"Voluptas","description":"King. (The jury all looked puzzled.) 'He must have imitated somebody else's hand,' said the Gryphon whispered in reply, 'for fear they should forget them before the trial's begun.' 'They're putting.","isbn":"9780998046761","image":"http:\/\/placeimg.com\/480\/640\/any","published":"1989-12-24","publisher":"Non Dolorum"}]}